"","title"
"Ex-White House doctor Ronny Jackson demands Biden take cognitive test or drop out of 2024 race","Ex-White House doctor Ronny Jackson demands Biden take cognitive test or drop out of 2024 race"
"Financial Expert: Indicators Point To An Impending Economic Downturn","Financial Expert: Indicators Point To An Impending Economic Downturn"
"Georgia DA: Trump Indictment Announcement Is Coming","Georgia DA: Trump Indictment Announcement Is Coming"
"All the Presidents Islamists | Frontpage Mag","All the Presidents Islamists | Frontpage Mag"
"President Biden officially declares hes running for re-election","President Biden officially declares hes running for re-election"
"Damning Court Doc Leak Reveals Fox News Was Plotting Against President Trump","Damning Court Doc Leak Reveals Fox News Was Plotting Against President Trump"
"Don Lemons fiery exchange with GOP candidate Vivek Ramaswamy left CNN leaders exasperated","Don Lemons fiery exchange with GOP candidate Vivek Ramaswamy left CNN leaders exasperated"
"Biden administration is quietly planning for a future where you dont own money","Biden administration is quietly planning for a future where you dont own money"
"The IRS Whistleblower Will Expose The Biden Protection Racket","The IRS Whistleblower Will Expose The Biden Protection Racket"
"Ramaswamy: Tucker Carlson 'Good Addition' for 2024 Presidential Race","Ramaswamy: Tucker Carlson 'Good Addition' for 2024 Presidential Race"
"Ratcliffe: Biden, Morell, and Blinken Knew They Were Lying About Hunter Laptop Because I Had Said It Wasnt Disinformation Publicly","Ratcliffe: Biden, Morell, and Blinken Knew They Were Lying About Hunter Laptop Because I Had Said It Wasnt Disinformation Publicly"
"Trump on Biden Reelection Announcement: He Is Worse than the 5 Worst Presidents Combined","Trump on Biden Reelection Announcement: He Is Worse than the 5 Worst Presidents Combined"
"Republicans: Biden is out of touch with reality - Discover Politics","Republicans: Biden is out of touch with reality - Discover Politics"
"Chicago Mayor Warns That If Local Walmart Locations Close People Will Have Fewer Places To Shoplift","Chicago Mayor Warns That If Local Walmart Locations Close People Will Have Fewer Places To Shoplift"
"Tucker Takes New Role On The View","Tucker Takes New Role On The View"
"Hageman Says Blinken Should Testify Over Biden Campaigns Role In Pushing False Claims About Hunters Laptop","Hageman Says Blinken Should Testify Over Biden Campaigns Role In Pushing False Claims About Hunters Laptop"
"Sen. Steve Daines, NRSC Chair, Backs Trump","Sen. Steve Daines, NRSC Chair, Backs Trump"
"Trump 'Shocked' by Carlson Ouster: Maybe He Needs 'Free Rein'","Trump 'Shocked' by Carlson Ouster: Maybe He Needs 'Free Rein'"
"Alvin Bragg Gets Terrible News: Attorney Charges Bragg's 'Prej","Alvin Bragg Gets Terrible News: Attorney Charges Bragg's 'Prej"
"Nunes: Blinken role on 2020 letter looks like ""it's really corruption""","Nunes: Blinken role on 2020 letter looks like ""it's really corruption"""
"Trump Book Hits Top Spot on Amazon","Trump Book Hits Top Spot on Amazon"
"Whitaker to Newsmax: Hunter Biden Case at 'Big Pivot Point'","Whitaker to Newsmax: Hunter Biden Case at 'Big Pivot Point'"
"Trump to Newsmax: Hunter Biden Intel Letter 'Treasonous'","Trump to Newsmax: Hunter Biden Intel Letter 'Treasonous'"
"Why Tucker Carlsons Anti-War Stance Got Him Fired from Fox News: The Shocking Truth About Rupert Murdochs Pro-Foreign Intervention Agenda!","Why Tucker Carlsons Anti-War Stance Got Him Fired from Fox News: The Shocking Truth About Rupert Murdochs Pro-Foreign Intervention Agenda!"
"Gab","Gab"
"Nearly half of Republicans don't want Trump to run for reelection in 2024, new poll shows","Nearly half of Republicans don't want Trump to run for reelection in 2024, new poll shows"
"These are the most important words Tucker Carlson has ever spoken. Listen to this.","These are the most important words Tucker Carlson has ever spoken. Listen to this."
"Coroner Rules Young Doctor Died from Blood Clot Due to COVID Vaccine - Wife Wants Death Certificate Changed","Coroner Rules Young Doctor Died from Blood Clot Due to COVID Vaccine - Wife Wants Death Certificate Changed"
"Ratings King Tucker Carlson Ousted At Fox News; Last Show Aired Friday","Ratings King Tucker Carlson Ousted At Fox News; Last Show Aired Friday"
"Fox Loses $930M in Market Value on Carlson Exit","Fox Loses $930M in Market Value on Carlson Exit"
"Carlson's Ouster Followed Calls by AOC, Schumer","Carlson's Ouster Followed Calls by AOC, Schumer"
"60 Minutes Segment with Jan. 6 Protestor Ray Epps Invites Further Skepticism From Pundits, Politicians","60 Minutes Segment with Jan. 6 Protestor Ray Epps Invites Further Skepticism From Pundits, Politicians"
"Fox News Founder Rupert Murdoch Pushed For Tucker Carlsons Ousting","Fox News Founder Rupert Murdoch Pushed For Tucker Carlsons Ousting"
"President Trump &amp; Tucker Carlson both eat Pizza on Tucker's last day at Fox. Message sent?","President Trump &amp; Tucker Carlson both eat Pizza on Tucker's last day at Fox. Message sent?"
"Glenn Beck pleads for Tucker Carlson to join him on Blaze News","Glenn Beck pleads for Tucker Carlson to join him on Blaze News"
"More Than Half of Moms of Boys With Gender Dysphoria Have Their Own Psychological Issues, According to Resurfaced Report","More Than Half of Moms of Boys With Gender Dysphoria Have Their Own Psychological Issues, According to Resurfaced Report"
"Hunter Biden Calls For Ethics Investigation Into Rep. Marjorie Taylor Greene For Unhinged Rhetoric","Hunter Biden Calls For Ethics Investigation Into Rep. Marjorie Taylor Greene For Unhinged Rhetoric"
"Tucker Carlson leaving FOX News -- FOX News said Carlsons last program aired on Friday, April 21.","Tucker Carlson leaving FOX News -- FOX News said Carlsons last program aired on Friday, April 21."
"CNN fires Don Lemon","CNN fires Don Lemon"
"Tucker Carlson leaves Fox News, network announces","Tucker Carlson leaves Fox News, network announces"
"Exclusive: Pence Lays Out Pro-Second Amendment 4-Step Plan to Stop Scourge of Mass Shootings","Exclusive: Pence Lays Out Pro-Second Amendment 4-Step Plan to Stop Scourge of Mass Shootings"
"This could be why trump is going after desantis so hard","This could be why trump is going after desantis so hard"
"Trump takes incredible 45-point lead in latest poll","Trump takes incredible 45-point lead in latest poll"
"Trump reminds Americans that in 2016, we SAVED the Republican Party","Trump reminds Americans that in 2016, we SAVED the Republican Party"
"Trump to packed house: Were going to ALL become the 47th President of the United States","Trump to packed house: Were going to ALL become the 47th President of the United States"
"President Trump touts 1.2 million vote lead over DeSantis in Florida","President Trump touts 1.2 million vote lead over DeSantis in Florida"
"New Trump book sales No. 1, and it's not even available yet","New Trump book sales No. 1, and it's not even available yet"
"Democrat Stacey Plaskett threatens Matt Taibbi with prison","Democrat Stacey Plaskett threatens Matt Taibbi with prison"
"WH's Susan Rice Steps Down Amid Migrant Children Report","WH's Susan Rice Steps Down Amid Migrant Children Report"
"2 GOP Leaders: Blinken Should Resign Over Laptop Letter","2 GOP Leaders: Blinken Should Resign Over Laptop Letter"
"Hunters Hideout: Troubled Biden Son Reportedly Camping At White House To Duck Baby Mamas Lawyers","Hunters Hideout: Troubled Biden Son Reportedly Camping At White House To Duck Baby Mamas Lawyers"
"Top Biden Adviser Will Leave White House Next Month","Top Biden Adviser Will Leave White House Next Month"
"Governor Sununu Defends Second Amendment On NBC: Gun Control Laws Dont Work","Governor Sununu Defends Second Amendment On NBC: Gun Control Laws Dont Work"
"What Other 'Russian Disinfo' Cries Were Lies To Help Biden?","What Other 'Russian Disinfo' Cries Were Lies To Help Biden?"
"Bidens DOJ Just Indicted Four Americans for Weaponized Free Speech","Bidens DOJ Just Indicted Four Americans for Weaponized Free Speech"
"New York Times jumps on bandwagon: Concerns about Biden's age are legitimate","New York Times jumps on bandwagon: Concerns about Biden's age are legitimate"
"AOC: 'The Government Must Shut Down Unapproved News Agencies To Defeat Fascism'","AOC: 'The Government Must Shut Down Unapproved News Agencies To Defeat Fascism'"
"SUZANNE DOWNING: This Democrat Donor Scheme Stinks To High Heaven","SUZANNE DOWNING: This Democrat Donor Scheme Stinks To High Heaven"
"AOC Targets Tucker Carlson With Grossly Authoritarian Threat","AOC Targets Tucker Carlson With Grossly Authoritarian Threat"
"Chicago teens charged with misdemeanor for stealing car, causing crash that killed baby, hurt 3 others","Chicago teens charged with misdemeanor for stealing car, causing crash that killed baby, hurt 3 others"
"CDC Isnt Following Science. Its Manipulating It for Gun Control "" NSSF","CDC Isnt Following Science. Its Manipulating It for Gun Control "" NSSF"
"New Biden rule will redistribute high risk loan costs to homeowners with good credit","New Biden rule will redistribute high risk loan costs to homeowners with good credit"
"Sen. Ron Johnson to Newsmax: Biden, Media Election Meddling Worse Than Russia, China","Sen. Ron Johnson to Newsmax: Biden, Media Election Meddling Worse Than Russia, China"
"Poll: 70 Percent of Americans Don't Want Trump to Run in 2024","Poll: 70 Percent of Americans Don't Want Trump to Run in 2024"
"Vivek Ramaswamy Goes There: 'Abortion Is a Form of Murder","Vivek Ramaswamy Goes There: 'Abortion Is a Form of Murder"
"Exclusive  Trump on Stopping School Shootings: If Just 5 Percent of Teachers Armed, Youre Not Going to Have a Problem Anymore","Exclusive  Trump on Stopping School Shootings: If Just 5 Percent of Teachers Armed, Youre Not Going to Have a Problem Anymore"
"Hunter Bidens Lawyers to Meet Prosecutor Weiss as Special Counsel Remains Unnamed by Garland","Hunter Bidens Lawyers to Meet Prosecutor Weiss as Special Counsel Remains Unnamed by Garland"
"KWI attorney reacts to trans woman flashing male genitalia at girls in locker room shower: keep our kids safe","KWI attorney reacts to trans woman flashing male genitalia at girls in locker room shower: keep our kids safe"
"NBC News Gives Biden the Bad News on How He's Doing as President: 'Not in a Good Place'","NBC News Gives Biden the Bad News on How He's Doing as President: 'Not in a Good Place'"
"Fettermans Return Turns Heads Across America  The Senator Drops Jaws with His Unexpected, Inappropriate Outfit","Fettermans Return Turns Heads Across America  The Senator Drops Jaws with His Unexpected, Inappropriate Outfit"
"James Woods Reaches Limit, Demands To See Manifesto Of Nashville Shooter","James Woods Reaches Limit, Demands To See Manifesto Of Nashville Shooter"
"WSJ News Exclusive | Hunter Biden Probe Is Being Mishandled, IRS Supervisor Says","WSJ News Exclusive | Hunter Biden Probe Is Being Mishandled, IRS Supervisor Says"
"Communism Is Liberty's Mortal Enemy","Communism Is Liberty's Mortal Enemy"
"Guy Named 'Joe' Caught Impersonating President After Loss Of Blue Checkmarks","Guy Named 'Joe' Caught Impersonating President After Loss Of Blue Checkmarks"
"Woke liberals are bashing conservatives for not being able to define woke: You all need to know what woke is","Woke liberals are bashing conservatives for not being able to define woke: You all need to know what woke is"
"Afghanistan has become a terrorism staging ground again, leak reveals","Afghanistan has become a terrorism staging ground again, leak reveals"
"School choice could destroy the Democrat party","School choice could destroy the Democrat party"
"Mature Enough: Undercover Video Reveals Docs Routinely Approve Puberty Blockers for Kids as Young as Eight","Mature Enough: Undercover Video Reveals Docs Routinely Approve Puberty Blockers for Kids as Young as Eight"
"Hakeem Jeffries Shows How Black Racism Is Baked Into The Cake","Hakeem Jeffries Shows How Black Racism Is Baked Into The Cake"
"Bidens corrupt web unraveling before our eyes","Bidens corrupt web unraveling before our eyes"
"Government Accountability Office Says Low Military Recruitment Levels Are National Security Threat","Government Accountability Office Says Low Military Recruitment Levels Are National Security Threat"
"Kathy Hochul 'test-marketing' ban on all NY tobacco sales","Kathy Hochul 'test-marketing' ban on all NY tobacco sales"
"Report: Bronx Judge to Be Removed from Criminal Cases After Freeing Accused Child Killer from Jail","Report: Bronx Judge to Be Removed from Criminal Cases After Freeing Accused Child Killer from Jail"
"Here's what Target in San Francisco looks like now","Here's what Target in San Francisco looks like now"
"Trump calls Florida a great place hours campaign derides it as worst","Trump calls Florida a great place hours campaign derides it as worst"
"But they said it was Russia Russia Russia","But they said it was Russia Russia Russia"
"Spy letter about Hunter Biden shows how Dems are undermining democracy","Spy letter about Hunter Biden shows how Dems are undermining democracy"
"Racist Joe Biden, Food Agendas, C19 Vaccine &amp; Gut Health, New Blood Clots Found, Bud Light, UFO Crash &amp; ETs Found In Brazil, Joe Biden Joke","Racist Joe Biden, Food Agendas, C19 Vaccine &amp; Gut Health, New Blood Clots Found, Bud Light, UFO Crash &amp; ETs Found In Brazil, Joe Biden Joke"
"Americans In High-Crime Cities Are Having Their Cars Bulletproofed, Says Armorer","Americans In High-Crime Cities Are Having Their Cars Bulletproofed, Says Armorer"
"1","Fox News Ratings Collapse by 50% as Newsmax Soars"
"2","Rasmussen Poll: Carlson More Popular Than Fox News"
"3","Utterly Useless: Biden Abandons Thousands Of Americans In War-Torn Sudan"
"4","Report: Biden Is Only Functional Six Hours A Day, Five Days A Week"
"5","Justice Alito Has Good Idea Of Who Leaked Dobbs Opinion; Suggests Motive Was Assassination"
"6","How Far Will Corporate Media Hacks Go To Cover For Biden?"
"7","The Left Is Trying to Destroy the Supreme Court Because They Can't Control It"
"8","FBI's War on Religion: Catholic Group Sues Government Agency Over Surveillance"
"9","IRS Planning to Hire Armed Agents in All 50 States"
"10","Jack Teixeira Was Denied a Gun License After Making Threats Against His School, but Somehow Got Intel Clearance"
"11","Crooked Joe Biden: Trump Retires Hillary Clintons Nickname"
"12","Hunter Biden will appear in court to face stripper baby mama over child support"
"13","Democratic Lawmakers Push Bill That Could Make Pedophiles a Protected Class"
"14","New York To Become First State To Ban Natural Gas Hookups In New Buildings"
"15","'Russia Disinfo' Hoax About Hunter's Laptop Is Bigger Than Blinken"
"16","Don't Believe the Media Fearmongering About Spending Cuts. In 2019, discretionary spending was $1.338 trillionor some $320 billion less than what Republicans want that side of the budget to be."
"17","Welcome to Woke Clown World"
"18","How is Joe Biden planning to bail out these a**holes?"
"19","FIRST TIME EVER MSNBC Is No. 1 at 8 PM, Tucker-Less Fox Time Slot Down TWO MILLION - Geller Report"
"20","Its A Bloodbath, Fox News Loses Half Their Audience After Firing Tucker Carlson: Megyn Kelly"
"21","Randi Weingarten is an evil liar"
"22","Fox News Sees Ratings NIGHTMARE, Tucker Carlson's Former Slot Sees Over Two MILLION Viewers Tune Out -"
"23","Biden Falsely Claims He Has Six Grandchildren, Leaves Off Hunters Arkansas Daughter"
"24","Pentagon Officials Openly CHEER Over Tucker Carlson Firing, Say Were A Better Country Now That Hes Off The Air"
"25","Unemployed Guy's Basement Selfie Video Crushes Fox News In Primetime Ratings"
"26","The Workings of the Woke Cult | James Lindsay"
"27","Bidens Journalist Cheat Sheet: New Collusion Scandal"
"28","Disarray Consumes Fox News after Carlson, Bongino Ousters"
"29","Trump: No President 'So Crooked or Dishonest as Joe Biden'"
"30","Trump: 'Dig, We Must; Drill, We Must' to Unlock Energy, Lower Inflation"
"31","Trump Vows to Declare War on Mexican Drug Cartels"
"32","Disgruntled Former Tucker Carlson Tonight Producer Reportedly Never Met The Host"
"33","Joe Biden's Campaign Site Made Big Mistake with Design - Now He's Paying for It"
"34","Biden Energy Secretary Wants Military to Adopt All-EV Fleet by 2030"
"35","Whistleblower Disappears After Planning to Reveal ‘Explosive’ Information on Biden Family Corruption"
"36","AP Censors Quote From Thug Who Shot White Family To Hide His Anti-White Racism"
"37","Tucker Carlson Breaks Silence after Fox Departure"
"38","Biden Busted With Cheat Sheet Showing He Was Asked Pre-Approved Questions During Rare Press Conference"
"39","Democrats Introduce Bill That Will Make It A Crime To Discriminate Against Pedophiles"
"40","Trump parrots liberal talking points to slam DeSantis, baffling critics: 'Bizarre'"
"41","Tucker Carlson is Right: It’s about Evil"
"42","Tucker Carlson Is Right: It's About Evil"
"43","Rep. Jordan: signers of 2020 Hunter laptop letter"
"44","Iran seizes oil tanker headed for Texas"
"45","Bill Barr to Newsmax: Hunter Biden Intel Letter 'A Political Stunt'"
"46","Emerson Poll: Trump Builds Massive Lead Over DeSantis"
"47","Rep. Comer to Newsmax: Probe Could Bring Biden Impeachment"
"48","Buttigieg Announces Closure Of Interstate System For 8-10 Days As Highways Undergo Racial Sensitivity Training"
"49","West Virginia GOP Gov. Justice jumps into race to challenge Democratic Sen. Manchin in 2024"
"50","How Ayn Rand Predicted Dylan Mulvaney"
"51","Biden Team Ran Clinton Playbook In Laptop 'Russian Disinfo' Hoax"
"52","'Russia Disinfo' Hoax About Hunter's Laptop Is Bigger Than Blinken"
"53","Trans Lawmaker Sets Internet Ablaze With Bill to Remove Anti-Pedophile Language From MN Human Rights Act"
"54","Blatantly Unconstitutional: Gun Rights Groups Sue Washington Over Assault Weapons Ban"
"55","Planned Parenthood Aborted Nearly 375,000 Unborn Children Last Year: Report"
"56","Schools Scrapping Homework, Deadlines In Shift To Equitable Grading"
"57","Shocking Discovery Found on Voting Rolls in Fourth Most-Populous County in the Nation"
"58","Minnesota bill would protect pedophiles as a sexual orientation"
"59","Feds Serve As Middleman In Multi-Billion Dollar Migrant Child Trafficking Operation: HHS Whistleblower"
"60","Reporter Who Secretly Gave Biden Question in Advance Gets Relentlessly Trolled"
"61","Biden Caught With Cheat Sheet During Press Conference  With Reporter's Question on It"
"62","Whistleblower: U.S. Government Acts as Middleman in Multibillion-Dollar Child Trafficking Operation"
"63","Twitter Suspends Account That Created Pedophilia Pride Flag In Celebration Of Alice Day"
"64","Inconceivable: Trump Comments On Bidens Re-Election Announcement"
"65","Fang Fang strikes again! Rep. Troy Nehls at hearing calls out Eric Swalwell for having an affair"
"66","Gleeful Tucker Carlson tells DailyMail.com his future plans"
"67","Biden cheat sheet shows he had advance knowledge of journalist's question"
"68","Viral Video! Man tells off heads of New York Times at public event. He Confronts them about Fake Reporting on Ukraine &amp; Nord Stream Pipeline!"
"69","Tucker Carlsons Accuser Breaks Silence, Gives Up Game: There is a feeling of justice, but its only partial, I thought that was very dangerous and didnt want that kind of power"
"70","Rasmussen Poll: 69% Say Hunter Biden IRS Issue Serious"
"71","Biden Proposes Free Health Care For Illegal Immigrants"
"72","Grassley Confirms: FBI Cried 'Russian Disinfo' To Protect Bidens"
"73","Gun Violence Isn't The Leading Cause Of Death Among Children"
"74","Joe Biden's Perfect Record of Failure Makes Him Unqualified for a Second Term"
"75","Trump Considering DeSantis For VP Pick, Source Claims"
"76","Georgia DA Puts Police On Heightened Security Amid Potential Mid-Summer Indictment of Trump"
"77","F*ck Joe Biden!"
"78","Second American killed in Sudan, Biden spox Kirby confirms"
"79","New Study Finds Face Masks Cause Brain Damage And Stillbirths Even When Worn For Short Period"
"80","'NO!': Donald Trump suggests he may skip Republican debates because of sponsors and venues"
"81","The New York Times on Biden: ""Strange as it may sound, the American government can function without a healthy president."" =,"
"82","Voters say no to Biden, but Joe is intent in finishing the (awful) job"
"83","BREAKING: WHO Warns Deadly Biological Attack Against Humanity Imminent After Rebels Take Biolab In Sudan [VIDEO]"
"84","First Republic stock slides further on questions around its survival"
"85","Biden accidentally calls Democrat congresswoman a man's name multiple times"
"86","Deep State Celebrates Tucker Departure from Fox with Anonymous Leaks"
"87","Armed Antifa terrorists are Arrested by Fort Worth Police after intimidating Peaceful Protestors"
"88","Americans Hoping Biden Makes It 2 More Years After 'Embarassing' Video of Kamala Harris Goes Viral"
"89","Seven Arrested After Protesting in Montana State House on Behalf of Transgender Representative Zooey Zephyr"
"90","Whistleblower to tell House that US govt is 'middleman' in multibillion dollar migrant child trafficking op"
"91","Whistleblower to tell House that US govt is 'middleman' in multi-billion dollar migrant child trafficking op | Fox News"
"92","Trump 'listening' to insiders urging him to make DeSantis VP"
"93","Fulton County DA Tells Cops To Expect Trump Indictment This Summer: I am providing this letter to bring to your attention the need for heightened security and preparedness in coming months due to this pending announcement"
"94","Tucker Carlson Puts Rupert Murdoch On Notice, Hires Powerhouse Lawyer To Handle Departure"
"95","Insane AOC's eyes get huge &amp; foams at the mouth as she talks about Tucker Carlson leaving Fox"
"96","Tucker Carlson Puts Rupert Murdoch On Notice, Hires Powerhouse Lawyer To Handle Departure"
"97","Judge: Hunter Biden Must Attend Paternity Hearings"
"98","Donald Trump to Newsmax: 'Something Will Happen,' Biden Won't Run"
"99","WATCH: RNC Responds To Biden Presidential Announcement With AI Video Depicting Bleak Future"
"100","Republicans Worry Hunter Biden Living at White House to Evade Legal Papers"
"110","John McLaughlin to Newsmax: Trump Best to Beat Biden"
"210","Rep. Comer to Newsmax: Hunter Biden 'Will Regret' Child Support Reduction Bid"
"310","Senate Republicans Demand Blinken Forfeit Hunter Biden Records"
"410","Trump Makes Deal To Appear At CNN Town Hall, Leftist Commentators Immediately Freak Out"
"510","Majority of Republican Voters Want 2024 Presidential Candidate Who Challenges Woke Ideas and Makes Liberals Angry"
"610","WATCH: Dwyane Wade And Family Heckled For Trans-ing Their 15-Year-Old Son  Why Did You MUTILATE Your Son??"
"710","BREAKING: Biden FINALLY Sending 1500 Troops To Mexico Border As Crisis Nears& But NOT To Catch Illegals"
"810","In Mexico, 15K Haitian Migrants Wait For Key Biden Policy To End"
"910","Hunter Finally Appears in Child Support Case, Judge Blasts Him for Concealing Income"
"101","MSNBC Meltdown: Mehdi Hasan Has a Hissy Fit Over Being Fact-Checked on Racial Crime Stats"
"111","Warren Buffet Drops TSMC for a Fistful of Dollars"
"121","DeSantis Signs Bill Legalizing Death Penalty For Child Rape, Defying Supreme Court Precedent"
"131","Ric Grenell to Newsmax: 'Outrageous' If Child Payments Wreck Hunter Biden"
"141","Rep. Comer to Newsmax: 'Missing Pieces' In Biden Family Finances"
"151","GOP House Permits IRS Agent to Discuss Hunter Biden Probe"
"161","Hunter to Answer Questions About Financials, Sit for Interview Under Oath"
"171","Middle school student allegedly sent home for refusing to change shirt that said 'There are only two genders'"
"181","Courts Sides With North Carolina, Florida Election Integrity Efforts"
"191","Info Behind Gen Z Political Influencers Like Harry Sisson Suggests DNC Is Up to Something Incredibly Sinister"
"201","WATCH: Massachusetts 7th Grader Speaks at Board Meeting After Being Sent Home Over Shirt Saying There Are Only Two Genders"
"211","Chuck Todd gets slapped with basic lesson in biology when he challenges Vivek Ramaswamy on the trans agenda"
"221","Bernie Sanders Calls for Confiscation of Wealth Above $999 Million"
"231","Texas AG Paxton Launches Investigation into Gain-of-Function Research and Misrepresentations by COVID-19 Vaccine Manufacturers"
"241","WATCH: Trump Supporters Turn Out for New Hampshire Rally, Discuss DeSantis, Ultra MAGA, and RINOs"
"251","12-year-old's speech to School Board, was sent home with t-shirt that said there are only 2 genders"
"261","San Francisco Whole Foods had more than 560 emergency calls prior to closing store due to crime, drugs"
"271","Death Toll Rises As Ukraine Increases Assaults On Russian Border Towns"
"281","Longtime Senate Democrat Ben Cardin won't seek re-election"
"291","SCOTUS Grants Review of Case That Will Gut the Federal Bureaucracy"
"301","Elon Musk tells Bill Maher that the woke mind virus has infiltrated schools and teachers are indoctrinating American youth"
"311","'Low-Risk' Borrowers Will Pay Higher Mortgage Fees For 'Equity'"
"321","The IRS Whistleblower Is About To Explode Biden Family Scandals"
"331","States revolt against Biden's 'disaster' mortgage redistribution rule to subside risky loans"
"341","Lori Lightfoot pleads with Gov. Abbott to stop sending migrants to Chicago: 'Dangerous and inhumane'"
"351","Protecting Children: Why Age-Verification Laws for Pornography Is Necessary"
"361","Trans cyclist picks up overall victory in Tour of the Gila"
"371","Middle school student allegedly sent home for refusing to change shirt that said 'There are only two genders'"
"381","FBI Admits They Are Spying On Tons Of Americans.. But Says Its Ok Because They Have Cut Back"
