"","title"
"391","Cruz Mocks Biden Admin for Pushing All Electric Military Vehicles: Hopefully Our Enemies Will Be Nice Enough to Install Charging Stations"
"401","Supporters of CCP are creating shootings to create buzz and pass legislation to remove our gun right!"
"411","Rep. Van Drew to Newsmax: Impeach 'Crooked' Biden"
"421","Prominent Names Found Meeting with Epstein After He Became Convicted Sex Offender"
"431","'Let's Go Brandon' Sweatshirts Get Two Students in Troublebut Theyre Fighting Back"
"441","GOP Senator Claims Blinken Lied Under Oath About Hunter Biden Contacts"
"451","Prominent Names Revealed From Epstein's Calendar Include Biden, Obama Officials"
"461","Ron Johnson: We Have Evidence Blinken Lied to Congress About Hunter Biden"
"471","WSJ: CIA's Burns, Others Met With Jeffrey Epstein"
"481","Deepsquat0311 on TikTok meets Virginia Democrat State Senator Joe Morrisey."
"491","Fleitz to Newsmax: Why Isn't Biden Worried About China?"
"501","Gallup: Biden's Worldwide Approval Dropping"
"511","Jeffrey Epsteins Private Calendar Shows Meetings With CIA Chief And Obama Admin Official"
"521","Border Congressman: Towns 100+ Miles Away From The Border Overwhelmed With Illegal Aliens"
"531","RNC Chairwoman: China Is Running This White House"
"541","Report: Jeffrey Epstein's Private Calendar Names CIA Director as Contact"
"551","James Woods Orders Joe Biden To Close The Damned Border Already, For The Love Of God"
"561","Coons on Biden Stumbling and Rambling: 'Compare Him to the Alternatives'"
"571","8 Ways Government Shielded Biden From The 'Laptop From Hell'"
"581","Pentagon Officials CHEER After Tucker Carlson Fired From FOX, CREEPY"
"591","Liberal NPR says the unsolved murder rate is soaring in California"
"601","Tinfoil Haturday: How RFK Jr. Could Save the Republic and Avenge His Father and Uncle"
"611","BREAKING NEWS: Scientists Just Exposed Plague That Could Kill A BILLION People- Entire PLANET AT RISK"
"621","East Palestine resident experiencing lesions, stomach pain, shortness of breath since train derailment"
"631","Eight House Republicans Join Democrats to Protect China from U.S. Tariffs"
"641","Summers: We Have 'a Stagflationary Problem Developing'"
"651","First Republic Bank Teeters on Edge of Abyss"
"661","CO Dems Go Over Cliff With Radical Take on Bill Targeting Indecent Exposure to Children"
"671","Judge Appoints Special Prosecutor To Build Case Against Soros Prosecutor: Rudderless Ship Of Chaos"
"681","Comer Raises Alarm About Biden Team and Possible Intimidation of Witnesses, 'They Fear for Their Lives'"
"691","Saturday morning gunfire erupts at South Carolina park, 9 injured: Sheriff"
"701","Biden Campaign Hires Stunt Double For High-Risk Stairs Scene"
"711","McCarthy takes Congress back to school on AI"
"721","Mayor Demands School Board Remove 'Pornographic' Material From School Libraries"
"731","Senator Hawley Calls For Full-Scale FBI Investigation Into 85,000 Migrant Kids Missing Under Biden"
"741","Trump on rigged elections: Everyone says you cant win California  I think its totally wrong"
"751","He is grossly incompetent: President Trump sounds off on Biden regarding reelection bid"
"761","Trumps Q&amp;A in New Hampshire contrasts with Bidens habit of hiding from questions"
"771","Trump vows to launch commission that will declassify and publish ALL documents on Deep State operations"
"781","NJ librarian sues parents for speaking out against sexually explicit books at school library"
"791","Trump on Abortion: Would 'Look at' Signing 15-Week Ban"
"801","Crooked Joe Biden: Trump Retires Hillary Clintons Nickname"
"811","Justice Alito Says He Has Pretty Good Idea Who Leaked Abortion Draft and Made Us Targets of Assassination"
"821","Hunter Biden Scheduled to Appear in Court for Child Support Case"
"831","Kamala Harris could be most consequential running mate in modern history as Republicans see weakness"
"841","Tennessee Officials Sued By Biden Hit Back With Promise To Fight Child Sex-Change Push"
"851","The House GOP Debt Ceiling Plan Would Restore Spending Caps. Good. The most important part of the Limit, Grow, Save Act is the limits."
"861","Border Towns See Disaster Without Federal Help As End To Title 42 Looms"
"871","Biden Unable To Participate In Democratic Debates Due To Looming Screenwriters Strike"
"881","Oh, Now We're Noticing President Biden's Light Schedule, Huh?"
"891","Biden hit by fact checker for repeatedly touting 'highly misleading' deficit claim: 'Bottomless Pinocchio'"
"901","Hunter's Lawyer Controls Entity with Stake in Chinese State-Backed Fund"
"911","AI Ability to Decode Your Brainwaves? Woman Denied Transplant for Refusing C19 Vaccine, Trans Teen Died from Sex Change, WOKE JOKE OF THE WEEK, Spiritual Practice Encouragement"
"921","500 Australians Join Worlds First COVID Vaccine Injury Class Action Lawsuit - Europe Reloaded"
"931","Separated at birth?"
"941","Don't believe the activists' hype: Trans people are not under threat"
"951","Groups Sue FBI, DOJ for Info About Leaked Memo Targeting Catholics"
"961","Outrage Builds as Saudi-Owned Company Pulls Groundwater from Drought-Plagued Arizona for Its Own Use"
"971","Federal judge grants injunction temporarily blocking enforcement of Illinois gun law"
"981","Josh Hawley Calls for 'Full-Scale' FBI Probe into 85K Missing Migrant Kids"
"991","CA bans non-electric train engines"
"1001","New Minnesota law could place you on govt bias registry if you say COVID-19 came from China"
"112","Hunter Biden's Legal Team, White House, Clash on Strategy"
"212","Dem. Rep. Colin Allred: Things Would Be Better If 2A Hadn't Been Written"
"312","Is Justice burying hard evidence of actual Joe Biden crimes?"
"412","Confidence In American Banks Is Low Amid Continued Financial Sector Tumult"
"512","Hold On There A Minute: Tim Pool Exposes Hypocrisy Of Pro-Abortion Guest In Mic Drop Moment"
"612","Denver City Council Member: Tax White-Owned Businesses And Give It To Black, Brown-Owned Businesses"
"712","National stand your ground bill"
"812","Matt Gaetz Introduces National Stand Your Ground Law"
"912","Rep. Comer says Biden familys witness intimidation will not stand amid investigation of Hunter Biden"
"102","Two dozen nations band together to reject Biden, EU sexuality education proposal at UN conference"
"113","New Chicago Mayor vows to fix all the damage done by the last Republican mayor in 1931 "" Genesius Times"
"122","Report: Sotomayor Didn't Recuse Self From Cases Involving Publisher"
"132","Grassley Demands DOJ Cough Up Document Over Biden Scheme"
"142","NEW: Uncovered Recruitment Email Confirms Infamous 'Intel Letter' Was Meant to Interfere in the 2020 Election"
"152","Bill Ackman Warns Banking System In Grave Risk"
"162","History and Civics scores drop for 8th graders; COVID lockdowns hurt childrens education"
"172","Mayorkas Working To Expand Migration From Central America As Border Surge Anticipated"
"182","Soros-Backed Prosecutor Kim Gardner Resigning Over GOP Pressure To Remove Her, Criminal Contempt Case"
"192","Former CIA Chief Sought Debate Talking Point With Hunter Biden Laptop Letter"
"202","New York bans gas stoves and furnaces"
"213","Whistleblower bombshell on Hunter Biden laptop story 'of grave concern to all Americans': GOP lawmaker"
"222","Regional bank shares plunge as possible PacWest sale reignites banking sector fears"
"232","Pfizer Quietly Financed Groups Lobbying for COVID Vaccine Mandates"
"242","Sen. Blackburn to Newsmax: We'll See if President in on 'Bribery Scheme'"
"252","Brennan, Clapper Set for Hunter Biden Laptop Testimony"
"262","Sen. Blackburn to Newsmax: It's Time to Protect Kids Online"
"272","Gallup Poll: Nearly Half Worried About Bank Money"
"282","EXCLUSIVE: Video Shows Migrants Released by Biden Admin Camping on El Paso Streets"
"292","Regional bank stocks continue to slide on Thursday with PacWest leading the way down 54%"
"302","Old man confronts Transgender ""woman"" &amp; says how Ridiculous it is"
"313","Federal Reserve Just Said Banks Are Sound And Resilient. Another One Is In Crisis."
"322","Democrat Turned Republican in North Carolina Already Sending Her Former Party Into Fits of Rage"
"332","Girl goes on Epic Rant at School Board meeting about BLM Flags &amp; politics in schools"
"342","Female lifeguard applicant who identifies as male exposes 'bare breasts' in front of 'several dozen children' at city pool"
"352","Woke researchers blasted for suggesting racial segregation of medical students: 'These are hateful ideas'"
"362","California reparations panel hints at $1.2 million payments to each Black resident"
"372","Schiff: Comer's Investigation into Biden a 'Fiasco' Full of 'Unsubstantiated Allegations'"
"382","GOPs Hone in on Antony Blinken and Wife's Contacts with Hunter Biden"
"392","Journalist Warns Governments Ushering In Global Totalitarianism Under Guise of Hate Speech Laws"
"402","Florida Mayor Speaks Out After Female Lifeguard Who Identified As Male Exposed Her Breasts To Children"
"413","Russia Blames United States for Drone Attack on Kremlin, Assassination Attempt on Putin"
"422","WATCH: DOJ Official Confesses On Tape That Merrick Garland ALLOWING Trans Men To Impregnate Women in Prison Then Paying Out MILLIONS To Rapists"
"432","Money that is supposed to pay for sick poor people will now be diverted to pay for tummy tucks and hair transplants for the ""gender diverse."""
"442","Trump Wants to Make Schools Great Again"
"452","Sen. Cruz to Newsmax: Open Border Caused 'Horrific' Crime"
"462","Biden Implicated In Bribery Scheme, Grassley And Comer Allege"
"472","Did FBI's Censorship Guy Hide Connections To Biden Scandal?"
"482","Liberal SCOTUS Justice Caught in Scandal That Blows up Recent Left-Wing Attacks"
"492","California Task Force Recommends Reparations Curriculum for Children"
"502","Biden Mega-Donor Reid Hoffman Admits to Visiting Jeffrey Epstein's Island"
"513","Comer Subpoenas FBI Record Alleging Criminal Scheme Involving Biden"
"522","Trump: Biden Allowing End of Title 42 'Absolute Lunacy'"
"532","Biden Mega-Donor Reid Hoffman Admits to Visiting Jeffrey Epstein's Island"
"542","Oversight Committee reveals FBI record claims Biden engaged with a foreign national in a criminal scheme, Comer SUBPOENAS"
"552","Trump SWAMPS Biden in the polls"
"562","Trump plans to end Russia-Ukraine war with the power of the Oval Office"
"572","Whistleblower Alleges FBI Has Evidence Of Biden Engaging In Bribery Scheme With Foreign National"
"582","Trump: Biden 'in Delaware Sleeping,' Should Be at Coronation"
"592","Oversight Subpoenas FBI Records Alleging Biden Bribe Scheme"
"602","Whistleblower alleges FBI, DOJ have document revealing criminal scheme involving Biden, foreign national"
"613","Biden Admin Sending 1500 Troops To Southern Border, Immigration Crisis Is Out Of Control"
"622","A bill opposed by the trans lobby actually passed in the Colorado House. It makes it a felony to exposure yourself to a minor."
"632","Biden Deploys 1,500 Troops At Border To Help Register New Voters"
"642","Pic/Vid: Shooter opens fire at FOX13 station in Memphis, Tenn."
"652","Joe Rogan Reveals What Insiders Told Him They REALLY Think About Biden 2024"
"662","Get Him Out Of Here!: Trump Kicked Fake News NBC Reporter Off His Plane For Asking Question About Bragg Probe"
"672","Sen. Johnson to Newsmax: Dems 'Intimidating' Justices Is a 'Travesty'"
"682","Karine Jean-Pierre Erupts When Pressed Over Claims That Biden Has Lowered Illegal Immigration By 90%"
"692","Karine Jean-Pierre Stonewalls Questions On Presidents Unacknowledged Arkansas Grandchild"
"702","The Navy Is Turning To Drag Queens To Help Boost Recruitment"
"713","Hunter Biden's Eye-Opening Excuse to Pay Less for His Child Involves Joe"
"722","New England Journal of Medicine Publishes Proposal Saying That Medical Students Be Segregated By Race"
"732","White House Refuses to Comment When Asked Why Biden Wont Acknowledge His Seventh Grandchild (VIDEO)"
"742","The GOP Has a Gen Z Problem : American Greatness"
"752","With Vice News Closing, White House Will Have To Lie To Public Directly"
"762","New York City manhunt under way for man who used pride flag to wipe his rear end"
"772","Social media users left horrified by SoCal restaurant's 'dystopian' playing of the National Anthem"
"782","Senate Republicans Demand Blinken Forfeit Hunter Biden Records"
"792","MTG, Florida Grand Jury Link Biden Family to Human Trafficking - The New American"
"802","Oh Boy Wake Up New Zealand"
"813","Stuart Varney: Hunter Biden's baby mama drama is a political minefield and 'nightmare' for the entire family"
"822","WATCH: Karine Jean-Pierre gets agitated when pressed on her claim illegal immigration down 90% under Biden"
"832","Nordstrom closing 2 San Francisco stores, cites 'dynamics' of downtown area"
"842","EXCLUSIVE: April Migrant Apprehensions in South Texas Border Sector Double Prior Month"
"852","DeSantis allows death penalty as punishment for convicted child rapists in Florida"
"862","I want you to help me on election evening: Trump talks 2024 election integrity"
"872","Trump stands for peace amid global chaos: I will prevent World War III"
"882","Trump: I was probably the first one to say Covid came from a lab in Wuhan"
"892","Help us stop a Muslim cemetery from being built on precious farmland"
"902","Biden's mortgage redistribution plan sparks ominous warning as experts note similarities to prior crisis"
"913","Florida woman arrested for assaulting Rep. Matt Gaetz during Miramar Beach festival"
"922","2011 emails reveal Hunter Biden helped business associates get access to VP Biden, top aide: 'I'll do the mtg'"
"932","Ken Paxton to Newsmax: Sanctuary Cities Get What They Asked For"
"942","WH Can't Keep Their Stories Straight, Get Busted on Lies as They Announce Troops to Border"
"952","White House Finally Gets Asked About Biden Disowning His Granddaughter"
"962","Report: Gun Sales Surge in States Eyeing 'Radical Measures' Against 2A Rights"
"972","Biden Falsely Claims Republicans Want to Cut Veterans' Benefits"
"982","Judge Suggests Hunter Biden's Art Dealer Reveal Prices of Paintings"
"992","Ramaswamy: 'Im Closer' to 2015's Donald Trump 'Than Today's Trump Is'"
"1002","CBS Poll: GOP Voters Want Woke Culture Challenged"
"114","Biden Reassures Americans That Someone In His Administration Is Probably Doing Something About The Border"
"214","Biden Falsely Bragged About Lowering the Budget Deficit. Now, It Is Predictably Rising Again."
"314","Longtime Thomas Friend Hits Back At Democratic Probe Into Financial Records"
"414","E. Jean Carroll's Original Trump Claims Were Stupid"
"514","Govt. Censors Violated Mandate To Fight Only Foreign 'Disinfo'"
"614","CIA Solicited Signatures For Hunter Biden Laptop Letter"
"714","Were Back: Tucker Carlson To Stream New Show Through Twitter"
"814","Border Patrol union rips DHS for warning of 'targeted enforcement' in Texas"
"914","Ron DeSantis Signs Bill Mandating Teaching About 9/11"
"103","Latest Leaked Video of Tucker Carlson Shows He Was Right All Along"
"115","CIA fast-tracked letter that falsely suggested Hunter Biden laptop was Russia op"
"123","Texas Governor Sends More Migrant-Filled Buses from Border to Sanctuary Cities"
"133","Tucker Carlson's Post-Fox Plan: I'm Taking My Show to Twitter"
"143","Despite Recent Poll, Election Forecaster Currently Shows Trump Trailing Biden in Electoral College Votes"
"153","Texas Gov. Deploying National Guard To Physically Turn Back Migrants Trying to Illegally Enter U.S."
"163","BREAKING: Trump Put Under A GAG ORDER By New York Judge"
"173","Trump Keeps GOP Support, Beating Biden Despite Legal Woes"
"183","Biden Rape Accuser Warns: If Something Happens To Me, All Roads Lead To Joe Biden"
"193","Trump dominates polling in Iowa ahead of Saturday rally"
"203","Morning Consult Poll: Trump Posts Biggest Lead Over DeSantis Yet"
"215","Indiana blocks schools from keeping students' gender identity secret from parents"
"223","BREAKING: Texas parents vote to secure conservative school board majorities"
"233","White House in Panic Mode: New York Post Banned as Prosecutors Close In on Hunter Biden"
"243","Democrat Reforms Are The Real Threat To Election Security"
"253","Conservatives, Get Busy Ballot Harvesting Or Get Busy Losing"
"263","Hunter Biden Associate Told to Start Singing or Face Jail Time"
"273","Research group linked to Covid lab leak fears will receive $2m in US taxpayer cash"
"283","AP-NORC Poll: Biden's Support Among Black Voters Slipping"
"293","Donald Trump is Issued 'Gag Order' Over Criminal Trial at Manhattan D.A.'s Request"
"303","Black man charged with murder in possible hate crime after shooting two white strangers in the back of the head"
"315","Chinese migrants find tips on social media for long trek to U.S.-Mexico border"
"323","Donald Trump is Issued 'Gag Order' Over Criminal Trial at Manhattan D.A.'s Request"
"333","James Comer to Hold Presser on Biden Family Transactions, Legislation"
"343","Republicans urge investigation into Biden's 'mismanagement' of emergency oil stocks"
"353","Biden bleeding support with Black voters as 2024 campaign heats up: poll"
"363","James Comer Subpoenas The F.B.I. For Alleged Biden Crime Scheme"
"373","Biden's Corruption Is What The Media Hoped For Trump"
"383","Rep. Comer to Newsmax: Revelations Coming on Bidens"
"393","New York Post Reveals How Biden WH Is Punishing Them - Again - for Their Hunter Biden Coverage"
"403","Phase 2 of the Biden-Ukraine money laundering scheme has begun. BlackRock now owns Ukraine. We pay, they profit. So glad we sent them $150 billion."
"415","Parents of Texas first-grader sexually assaulted by students not told for over a week"
"423","Jan. 6er Makes Heartbreaking Call After Learning His Of Stunning Sentence Then Reveals Juror #8 Flipped Me Off While Reading Sentencing"
"433","All This Failure is Deliberate"
"443","All This Failure is Deliberate -- As our society crumbles and dissipates into total chaos the Marxist Left will be able to assume all power, and the people will gladly give it to them in order to restore some measure of peace and stability to their lives."
"453","Neo-Nazi Texas mall shooter Mauricio Garcia removed from the Army over 'mental health' concerns"
"463","SoS Says 2020 Election Was Stolen After Reviewing Evidence - Headline USA"
"473","Biden Quietly Creates New Disinformation Office To Arrest Americans For Fake News"
"483","Biden's Border Chief Says He Can't Explain Border Rush"
"493","GOP Threatens Blinken With Contempt Over Afghanistan Docs"
"503","Attorneys: Major Misconduct In Georgia D.A.'s Get-Trump Crusade"
"515","Washington's Rifle Ban Doesn't Hold Up Under Any Scrutiny"
"523","Human Tsunami Expected at Border When Title 42 Expires, 10,000 Reportedly Set to Cross Day 1"
"533","Klaus Schwab, Yuval Noah Harari &amp; Elon Musk: The Agenda In Their Own Words"
"543","Dont Expect a Dark-Horse Republican Nominee"
"553","Migrant Apprehensions at Border Hit 9K per Day, Says Texas DPS"
"563","ABC/WaPo Poll: Trump Opens up Clear 7-Point Lead over Biden in 2024 Race"
"573","Joe Biden is Preparing to Pardon Hunter Biden, But He May Have to Pardon Himself First"
"583","Comer Announces Bombshell News Coming on Joe Biden, 'Wednesday Will Be a Very Big Day'"
"593","Most Americans Dont Think Biden Is Mentally Or Physically Fit Enough For Second Term: Poll"
"603","Governor Abbott Shreds Biden Over Border Disaster: Caused Solely By Policies Put Into Place By Joe Biden"
"615","Rep. Comer urges DOJ to hold possible Hunter Biden indictment until press briefing: &amp;#x27;Drop in the bucket&amp;#x27;"
"623","Tucker Carlson 'preparing for war' with Fox News after ousting"
"633","Bill Barrs Warning on Trump. The former Attorney General says his one-time boss lacks the ability to deliver on his policy priorities."
"643","Biden Says My Son Has Done Nothing Wrong. The President sends an inappropriate signal to the Justice Department."
"653","Lawyer demands probe of FBI's 'seriously bungled examination' of Epstein"
"663","ABC Poll: Trump Up 6 Points on Biden; DeSantis Up 5"
"673","Elon Musk: Why Does The Media Misrepresent Interracial Crime 'To Such An Extreme Degree'?"
"683","US Navy then- Navy now&>*"
"693","Johnson: 'I have no faith or confidence in Wray or Garland'"
"703","Biden defends Hunter ahead of possible federal charges"
"715","Brian Kemp Opens up a Can Against Soros-Backed Prosecutors"
"723","Biden setting stage for pardoning Hunter as he frames potential DOJ charges as 'political witch hunt': Devine"
"733","'Jaws' Star Rips Into Oscars' Diversity Requirements'They Make Me Vomit'"
"743","Candi CdeBaca: White businesses should pay reparations"
"753","Poll: Majority of Republicans Say Trump the 'Strongest Candidate' for 2024"
"763","NBC Fabricates Fake Trans Propaganda About Montana Mom Who Cared For Suicidal Daughter"
"773","Tucker's First Speech After Fox: Manufactured Media Lies Can End Democracy - Geller Report"
"783","Bracing for impact: Biden world preps for Hunter Biden fallout"
"793","Trump criticises Biden for skipping Charles' coronation ceremony"
"803","Tucker Carlson's Revelation on Congressional Members 'Controlled by the Intel Agencies' Resurfaces After"
"815","Eric Adams Sending Illegal Immigrants To Suburbs After Biden Admin Snubs NYC On Funding To Deal With Crisis"
"823","Lawyer Asks DOJ To Look Into Why FBI Utterly Failed To Investigate Jeffrey Epstein"
"833","RuPauls Drag Race and Were Here Star Accused of Raping Production Assistant After Crew Party in 2020"
"843","Vice Media Is Selling To Soros Fund Management, Get Woke Go Broke"
"853","Dick Morris to Newsmax: Trump Can Fuse Politically Divided Country"
"863","Republicans Move To Curb Biden's Election Interference"
"873","Biden's Delusions About Himself and Hunter Are on Full Display During MSNBC Interview"
"883","Biden refrains from attacks on McCarthy as debt ceiling fight favors GOP"
"893","What Might Be Keeping Tucker Carlson Quiet"
"903","Calls for Bidens impeachment rise amid House investigation"
"915","Trump warns that expiration of Title 42 will cause a total border collapse"
"923","Deadbeat Grandpa Joe Has Thoughts On Deadbeat Nations, But No Time For His Youngest Granddaughter"
"933","Hunter Bidens Quest To Avoid Paying Child Support For His Illegitimate Daughter"
"943","Trump calls Biden 'very disrespectful' for not attending King Charles' coronation"
"953","Biden: Hunter Has 'Done Nothing Wrong' and His Situation Impacts My Presidency 'By Making Me Feel Proud of Him'"
"963","Majority Report Cohost Suggests The Expectation Of Safety On Public Transportation Is Bourgeois"
"973","Sign to help slow down the spread of propaganda supported by the US government."
"983","Rep. Chip Roy Introduces Bill to Keep Non-Citizens From Voting, Thwarting Democrat Election Strategy"
"993","Wealthy Democrat Mega-Donor Eliot Culter Gets Just 9 Months In Jail for Child Pornography"
"1003","Democrat donor bankrolling E. Jean Carroll's ""rape"" lawsuit against Trump visited Epstein Island..."
"116","Oversight Committee will pursue Biden probe to its extent after new evidence"
"216","Trump rightfully appeals E. Jean Carroll verdict: HOPEFULLY JUSTICE WILL BE SERVED"
"316","Stagflation Alarm: Consumer Sentiment Crashes, Hope Plunges, Long Run Inflation Fears Rise"
"416","Fed Official Warns More Hikes May Be Needed Because Inflation Is Still Too High"
"516","CIA had no evidence Biden laptop was Russian disinformation, says top intel officer during 2020 election"
"616","Cruz Explodes At The Border Over Bidens Crisis: This Is Deliberate! Nothing Less Than An Invasion!"
"716","Congressmen, Virginia Gov. Youngkin Demand Answers On Loudoun Enemies List"
"816","No Light At The End Of The Tunnel: Illegal Immigrants Surge Across Border As Trump-Era Rule Ends"
"916","Mayor Eric Adams Sends Bus of Migrants to New York City Suburb"
"104","House GOP demands Mayorkas brief on potential security risks at US ports related to China-made cranes"
"117","Growing crisis proves: Bidens ONLY priority is to admit em all"
"124","House GOP reveals documents on Biden familys shady financial history: What business are they in?"
"134","Rep. Self to Newsmax: Border Surge 'Existential Threat'"
"144","Rep. De La Cruz to Newsmax: Border Crisis Turned Into 'Border Chaos'"
"154","Gov. Abbott to Newsmax: Texas Deploys More Forces to Border"
"164","Trump Applauds Ratings for CNN Town Hall: 'Many Minds Were Changed'"
"174","Dem Arizona Mayor: 'The Border's Wide Open'"
"184","WaPo Admits 'Zuckbucks' Were Used To Turn Out Dems In 2020"
"194","Fox News sued for defamation by ex-government disinformation chief | Fox News"
"204","FBI Dismisses Congress' Subpoena for File on Biden Bribes:, Claims National Security Could Be Violated"
"217","Left Furious With CNN as Trump 'Wins' Town Hall"
"224","Dan Bongino: Trump Wrapped Up 2024 GOP Nod After Town Hall"
"234","Hunter Biden and ex-wife Kathleen Buhle's divorce attorneys were aware of 'Romania deal' payments"
"244","U.S. Sen. Rubio introduces bill to beef up air bases that would defend Taiwan"
"254","Biden investigation: FBI fails to comply with subpoena for Biden criminal scheme document"
"264","LEAKED: Emails Show Biden State Department Sought to Protect China During Spy-Balloon Fiasco"
"274","Foreign Ownership Exposed"
"284","Florida Attorney General sues Biden administration to stop mass release of migrants as Title 42 comes to an end"
"294","NYT Reports On Biden Corruption Evidence By Denying It Exists"
"304","Media Brought That Amazing Trump Town Hall Upon Themselves"
"317","Florida AG Sues Biden Administration to Stop Massive Illegal Alien Surge"
"324","Trump slams Mike Pence, reiterates rigging allegations at CNN Town Hall"
"334","Unstoppable Trump? Critics Lament His Dominance at CNNs Town Hall"
