"","title"
"344","Nolte: Trump's Glorious Town Hall Performance Mightve Delivered the Final Killshot to CNN"
"354","DOJ Does Not Deny Record Alleging Criminal Scheme Involving Joe Biden"
"364","Video Shows Biden Admin Dumping Migrants on Texas Border City Streets"
"374","Chicago Residents Informed The City Plans To Take In 250 Migrants. Watch How They React."
"384","How CNN Just Boosted Trump"
"394","Regional Bank Stock Plummets After Company Reveals Deposits Dropped Again"
"404","Dems Urge Biden To Loosen Sanctions On Communist Cuba, Socialist Venezuela To Mitigate Border Crisis"
"417","Migrants Ditch Visas And Identification Papers In Sea Of Trash Just After Illegal Crossing"
"424","66% of Conservatives &amp; 46% Of Independents Distrust U.S. Elections, New Study Finds"
"434","Its Dangerous: AOC Criticizes CNN For Trump Town Hall"
"444","Biden DHS Using Encrypted Chatroom To Collude With Mexican Officials To Bring Illegal Aliens Into U.S."
"454","Trump Doral event has speakers who espouse anti-Semitic views, far-right conspiracies"
"464","Trump DESTROYS CNN In Townhall, CNN PULLS PLUG EARLY After Trump WINS Debate With Kaitlan Collins"
"474","Biden DHS Coordinating Illegal Immigration In-Flows with Mexico"
"484","Feds arrest alleged Chinese spy in Boston"
"494","NYC migrant housing crisis threatens return to work push"
"504","Biden quietly admits the border has been in chaos 'for a number of years' ahead of Title 42 expiration"
"517","11 Hunter Biden Laptop Letter Signers Have Visited Biden's WH"
"524","How To Unravel Government's Hunter Biden Laptop Info Ops"
"534","Trump on Fire: Drops Kaitlan Collins on Jan. 6, Ukraine and Classified Docs"
"544","Triggered Tapper: CNN Anchor Has a Conniption Over Trump Town Hall"
"554","Donald Trump Gives No Quarter to E. Jean Carroll - or Her 'Hanky Panky' Claims - at CNN Town Hall"
"564","CNN Trump Town Hall Proves That Donald Trump Is Still the One to Beat for 2024"
"574","Mass Catch And Release: Biden Admin Releasing Migrants Into U.S. With No Ability To Track Them"
"584","Combative Trump Spars With CNN Anchor Over Election Claims, Documents In Town Hall"
"594","Trump on Fire: Drops Kaitlan Collins on Jan. 6, Ukraine and Classified Docs"
"604","Trump Announces He Will Pay $5M Judgment In Collectible NFT Trading Cards"
"617","Notable Moments From First Part Of Trumps CNN Town Hall In New Hampshire"
"624","Trump: Sexual Assault Case Was 'Fake'"
"634","CNN Town Hall: Trump Says He'll Pardon Many Tied to 1/6"
"644","'A Trump Infomercial': Backlash Erupts Against CNN for Hosting Trump"
"654","Trump on CNN: Focus on Mental Health, Not Restricting 2nd Amendment"
"664","Trump: 'I'm inclined to Pardon Many' J6 Prisoners if Elected"
"674","Trump Hijacks CNN, Steamrolls Kaitlan Collins in New Hampshire Townhall"
"684","GOP presidential candidate Vivek Ramaswamy to announce Constitutional amendment to raise voting age to 25"
"694","FBI refuses to give Congress informant file alleging Biden took bribes"
"704","530K illegal migrants sneaked into US since October: CBP"
"717","FBI doesn't share document GOP subpoenaed alleging 'criminal scheme' involving Biden"
"724","Soros Prosecutors Staffer, Dem Candidate In Violence-Tinged Group That Plotted Against Conservative Parents"
"734","Active CIA Employee Asked Intel Veteran If He Would Sign Hunter Biden Letter: Report"
"744","DOJ Timed Political Arrest With Presser Showing Biden Corruption"
"754","Bidens Made Millions Trading Political Favors For Foreign Money"
"764","Biden Administration To Release Migrants Into U.S. With No Way Of Tracking Them"
"774","Harlan Crow rebuffs Senate Democrats request for Clarence Thomas gift details"
"784","Rep. Burchett to Newsmax: WH Lying About Allegations"
"794","House Committee Unleashes Big Dirt on Biden: Pages of Bank Records and 2 Devastating Charts"
"804","U.S. watchdog says it found unacceptable problems with Chinese company audits"
"817","Colorado mom sues school that recruited sixth-graders for secret after-school gender and sexuality club"
"824","GOP holds BOMBSHELL Press Conference on ""Benedict Biden"" family Business Schemes"
"834","Democrats Shocked As Gavin Newsom Rejects Woke Reparations Boards Plan To Give Cash To Eligible Black Californians"
"844","Biden family members who allegedly got foreign money identified"
"854","'Bombshell': Newly Revealed Bank Records Show Bidens Profited from Corrupt Foreign Influence"
"864","House Republicans Lay Out Damning Case Of Biden Familys Alleged Corruption"
"874","Rep. Comer: Probe Reveals Bidens' 'Influence Peddling'"
"884","Oversight Committee: Biden Family Business Received over $10 Million from Romania, China for Unknown Work"
"894","Biden family received millions from foreign nationals, tried to conceal source of funds: House Oversight"
"904","Comer shows Bidens got $1M from convicted Romanian businessman"
"917","WATCH: Sen. Ron Johnson Lays Out PROOF Biden Spent Thousands Of Dollars On Hunters Sex-Trafficked Prostitutes"
"924","Oversight Committee will deliver update on Biden familys influence peddling to enrich themselves on Wednesday"
"934","Trumps New York jury verdict is a prime example of Americas decaying justice system"
"944","Colorado mom sues school that recruited sixth-graders for secret after-school gender and sexuality club"
"954","Texas school covers up sexual assault of 6-year-old girl by fellow classmates, protests ensue"
"964","Comer to Newsmax: Wed. Press Conference Will Show Biden Influence Peddling"
"974","Sen. Cruz to Newsmax: Biden Makes Immigration Disaster Worse"
"984","House Speaker Kevin McCarthy blocks Rep. Rashida Tlaib from hosting anti-Israel event"
"994","Trump Can Win"
"1004","Chicago Mayor Lightfoot Calls State of Emergency, Blames TX Gov. for Influx of Illegals"
"118","Murderers Motives Matter To Media Unless Christians Are Targets"
"218","By The Standards Democrats Applied To Trump, Biden Is A Traitor"
"318","Jonathan Turley Skewers the Media for 'Blackout' on 'Biden Corruption'"
"418","At Least 26 Shot in Chicago During Lightfoot's Last Weekend as Mayor"
"518","Elon Musk Asks Former CNN Host to Bring Show to Twitter - News Weekly"
"618","BREAKDOWN: Why Are There Two Fasces In Congress?"
"718","BREAKDOWN: Why Are There Two Fasces In Congress?"
"818","California reparations panel wants to give state agency veto power over local real estate decisions"
"918","Report: Border Patrol Arrests Afghan on FBI Terror Watchlist"
"105","Democrat Senator Says People Will Revolt If Supreme Court Blocks Gun Control"
"119","Afghan National On FBI Terror Watchlist Crossed Border: Report"
"125","Mark Green Hammers DHS Secretary Mayorkas Over Claims Illegal Border Crossing Have Dropped"
"135","The Left's 2020 Fake Electors Narrative Is Fake News"
"145","Mike Morell cant clean up this dirty letter that was meant to secure Biden's 2020 win"
"155","Afghan national on FBI terror list nabbed trying to cross border with migrants"
"165","Democrat Chris Murphy Goes Full Insurrectionist and Predicts 'Popular Revolt' to Force America to Accept Gun Control"
"175","At Least 5 Whistleblowers Come Forward Against Biden Family"
"185","EXCLUSIVE: DOJ Proposal Would Ban FBI Agents From Using Community Crime Statistics In Law Enforcement, Docs Show"
"195","Biden allegations were once the 'bread and butter' of the DOJ fraud and corruption unit: Former US Attorney"
"205","The Hill: 'CNN Gave Trump His Best Campaign Moment So Far'"
"219","CBS segment highlights how adding bugs to the food system 'could be a game-changer' to fight climate change"
"225","Teacher Gave Same Assignment For 15 Years, Notices Big Difference"
"235","Teacher Gave Same Assignment For 15 Years, Notices Big Difference"
"245","Poll: Most Democrats In Favor Of Welcoming Immigrants Into Someone Else's Neighborhood"
"255","President Trump: Im fighting the Deep State&and Winning! - News Weekly"
"265","Former Teacher Faced 170 Years In Prison For Molesting 1st-Grade Girls"
"275","Former Teacher Faced 170 Years In Prison For Molesting 1st-Grade Girls"
"285","Soldier Dies In Afghanistan, Wife Opens Laptop, Finds Hidden File - News Weekly"
"295","VIDEO: Dennys Customer Regrets Slapping Waitress On Butt"
"305","VIDEO: Dennys Customer Regrets Slapping Waitress On Butt"
"319","Comer Says He Cant Track Down The Informant In Biden Family Investigation"
"325","Fleitz to Newsmax: Strip Clearances from Hunter Biden Letter Signers"
"335","Rep. Burlison to Newsmax: Biden Family Set Up 'Complex' Network to Get Foreign Money"
"345","Rep. Burchett to Newsmax: Is 'Compromised' White House Threatening National Security?"
"355","Marines Remains Were To Be Mailed To Mom, Bikers Say Hell No"
"365","Marines Remains Were To Be Mailed To Mom, Bikers Say Hell No"
"375","Marines Remains Were To Be Mailed To Mom, Bikers Say Hell No"
"385","Firearms trainer rips liberal states strict gun bill: discriminating against women'"
"395","Joe Biden Faces Terrible Polling Week"
"405","EXCLUSIVE: Large Migrant Groups Return to Texas Border Post Title 42"
"419","Here is Why a Famous Harvard Historian Predicts Donald Trump Will Defeat Joe Biden in the 2024 Election"
"425","Marjorie Taylor Greene Wants to Call Up Hunter Bidens Foreign Prostitutes to Testify Before Con"
"435","Biden Admin Launches Initiative to Train Public How to Spot Radical Conservatives and Fight Domes"
"445","Heres why Illegal immigrants are reportedly getting smartphones on the taxpayers dime"
"455","Biden Admin Launches Initiative to Train Public How to Spot Radical Conservatives and Fight Dome"
"465","California Faces a $32 Billion Deficit, 'This Was Not an Easy Budget'"
"475","Late-stage capitalism? No, we're plagued by late-stage progressivism"
"485","If You See a Man With a Painted Fingernail, Theres a Meaning Behind It"
"495","If You See a Man With a Painted Fingernail, Theres a Meaning Behind It"
"505","Outback Workers Wish Nobody Saw What They Wrote On Cops Receipt - News Weekly"
"519","Wedding guests scramble after hotel taking NYC migrants cancels rooms"
"525","FBI Special Agent Talks Chemtrails, Illuminati, JFK, 9/11, Trafficking, Satanic Rituals #Geoengineering"
"535","Marjorie Taylor Greene says Hunter Biden's prostitutes may testify before Congress"
"545","Joe Biden - White Supremacy - Racism, Racist, White Supremacist"
"555","Biden administration to appeal decision which blocks the release of migrants without dates"
"565","DeSantis: GOP 'Must Reject the Culture of Losing,' No More 'Excuses'"
"575","Bidens Education Secretary Under Fire Over Potential For Fraud In Student Loan Bailout Scheme"
"585","REPORT: Top German Newspaper Killed Major Corruption Story to Please Joe Biden"
"595","Biden Rule Wants Power Plants To Cut Pollution By 90%, Or Be Shut Down"
"605","Biden's Ambassador is Nailed Admitting 'Walls Work' as U.S. Immigration Crisis Explodes on Southern Border"
"619","Chicago Residents Rise Up Against Biden's Illegal Migrant Wave, Condemn 'Replace"
"625","Homeless vets are being booted from NY hotels to make room for migrants: advocates"
"635","Marjorie Taylor Greene says Hunter Biden's prostitutes may testify before Congress"
"645","White House Now Backpedaling and Scrambling After Comer's Interim Report Shows Big Biden Lie"
"655","GOP Rep. Mace: The Amount of Evidence Against Hunter Biden 'Is Ridiculous'"
"665","White House: You Can't Compare Border to Afghanistan Withdrawal -- 'Not Chaos' at Border, 'at Least Not Right Now'"
"675","Migrant influx after Title 42 expiration creating a 'public health emergency,' Dr. Marc Siegel warns"
"685","Homeless Veterans Kicked Out Of Hotels To Allow Migrants To Move In, Support Group Says"
"695","Former NYC First Lady Told Residents To Physically Intervene To Stop Street Harassment"
"705","Biden Heads To Beach After Shattering All-Time Record With 83,000 Illegal Aliens Storming Border In 1 Week"
"719","Rep. Boebert to Newsmax: Biden Got $10M From Foreign Rivals as VP"
"725","Comer: Subpoenas for Biden Family Are 'More Than Likely'"
"735","Hanson to Newsmax: FBI Subpoena Refusal Shows Biden Scandal 'Irrefutable'"
"745","Rep. Gaetz to Newsmax: Town Hall a Win for Trump, CNN"
"755","California's Governor Says State's Budget Deficit Has Grown to Nearly $32 Billion"
"765","Former Prosecutor in Trump Criminal Probe Pleads the 5th in Deposition Taken by GOP"
"775","Virginia mom says activists threatened to 'curb stomp' her for speaking out against school curriculum"
"785","Migrants with Dubious Asylum Claims Enjoy Massive Court Backlogs"
"795","Exclusive: Rep Issa Calls for Investigation by CIA Inspector General"
"805","California Serial Killer Turns Out to Be An Illegal Obama Dreamer"
"819","Genius: Elon Musk Saves 22% On Twitter Executive Salaries By Hiring Female CEO"
"825","Matt Gaetz Has a Theory On Why CNN Shutdown Trumps Town Hall Early"
"835","CCP-Controlled, State-Owned Firm Behind Chinese Cash Allegedly Funneled To Hunter Biden, Documents Show"
"845","Ted Cruz slams Biden over border situation"
"855","Report: Lawyers for Hunter Biden, Ex-Wife Aware of $1M Romanian Deal"
"865","Texas Gov. Abbott: Biden WH Pulling Patrol Agents Off Border"
"875","WaPo Admits 'Zuckbucks' Were Used To Turn Out Dems In 2020"
"885","Virginia To Exit Leftist-Controlled Voter Roll Group ERIC"
"895","9 Questions Media Should Ask Biden About Corruption Evidence"
"905","Vivek Ramaswamy Proposes Raising Voting Age to 25"
"919","Judge Rules Banning 18-20 Year Olds From Purchasing Firearms Is Unconstitutional"
"925","CNN Employees FREAK OUT Over Trump Town Hall, CNN Is IMPLODING"
"935","US judge strikes down federal law barring handgun sales to those under 21"
"945","FBI Special Agent Talks Chemtrails, Illuminati, JFK, 9/11, Trafficking, Satanic Rituals &amp; Sex Crimes #Geoengineering"
"955","Melania Trump says she supports her husband's 2024 campaign"
"965","Peter Navarro to Newsmax: Dems Hope Border Crisis Expands Voter Base"
"975","Senator Warns Donald Trump of 'Impeachment' If He Issues Pardons for J6 Defendants as President"
"985","Judge Orders Trump to Appear Before Court So He Can 'School' Him on Gag Order During Political Campaign"
"995","GOP applauds Trumps CNN town hall performance: he is the president America needs"
"1005","Trump RIPS Joe Biden for allowing foreign nationals to cross border"
"120","Betrayal: FBI Agents Working On Russia Probe Say Leaders Concealed Intelligence On Hillarys Role"
"220","John Fetterman Clearly Struggles Through Questions At Senate Hearing"
"320","Man Plants 6k Trees To Honor Wife: 15 Years Later, Photos Reveal Motive"
"420","Man Plants 6k Trees To Honor Wife: 15 Years Later, Photos Reveal Motive"
"520","WHO States Sex Education Starts From Birth, Un Seeks To Decriminalise Sex With Minors"
"620","FBI Contractor Created Fake Online IDs to Join Chatrooms Run by Groups Organizing Against Vaccine Mandates"
"720","Gidley to Newsmax: Removal of IRS Investigators of Hunter 'Stinks'"
"820","Matt Whitaker to Newsmax: Durham Report Details 'Outrageous Moment' in US History"
"920","Does John Durhams Strongly Worded Letter Make You Feel Better?"
"106","Hunter Biden IRS probe purge may be unprecedented: John Fort"
"1110","Soldier Goes To Order Taco Bell Meal, Stops Cold When He Hears 2 Boys"
"126","Soldier Goes To Order Taco Bell Meal, Stops Cold When He Hears 2 Boys"
"136","Karine Jean-Pierre ends press briefing after being pressed on Durham report: 'Fled the podium'"
"146","Donald Trump to Newsmax: Durham Report 'Great Vindication'"
"156","THIS IS HUGE!  BREAKING NEWS: Maricopa County Superior Court Judge G..."
"166","Woman Insults Cashier Wearing US Flag, Mans Reaction Stuns Shoppers"
"176","Woman Insults Cashier Wearing US Flag, Mans Reaction Stuns Shoppers"
"186","Sen. Josh Hawley calls for Hillary Clinton to be prosecuted, consequences for FBI"
"196","Retired general suspended after tweet critical of Jill Biden"
"206","Retired general suspended after tweet critical of Jill Biden"
"2110","FBI ignored 'clear warning sign' of Clinton-led effort to 'manipulate' bureau for 'political purposes'"
"226","IRS whistleblower letter accuses DOJ of retaliation in Hunter Biden probe"
"236","From the Trump-Russia Collusion Plot to 2020 - The Face of the Democrat Party"
"246","Mark Levin: FBI Needs to Have Its Budget Slashed  It Needs to Be Broken Down and Rebuilt"
"256","Peter Schweizer: Houses Hunter Findings Are Just the Beginning"
"266","Elon Musk says George Soros hates humanity"
"276","Dershowitz to Newsmax: Durham, Biden Letter Show 'Get Trump' Push"
"286","Pam Bondi to Newsmax: 'Damaged' FBI Agents Should Pay Targets' Legal Fees"
"296","Biden, NYC Mayor Adams Break Caused by Migrants, Crime"
"306","Desperate NYC Might House Migrants in School Gyms"
"3110","FBI Special Agent Talks Chemtrails, Illuminati, JFK, 9/11, Trafficking, Satanic Rituals &amp; Sex Crimes #Geoengineering"
"326","Media Admits They Lied About That Russia Collusion Thing But Are Totally Telling The Truth About Everything Else"
"336","Texas becomes 19th state legislature to ban transsexual drugs/procedures for minors"
"346","'We started running': 8 killed in Texas outlet mall shooting - News Weekly"
"356","Media's Lies About The Durham Report Vs. What The Report Said"
"366","Sad Scene at MSNBC as Hosts and Analysts Have Struggle Session Over Durham Report"
"376","Durham Report Spells Out How Much FBI Investigation Relied on 'Leads' From Trump's 'Political Opponents'"
"386","Colorado Democrat Calls For White Business Owners To Pay Special Reparations Tax"
"396","Top Aide To Democrat Mayor ARRESTED For Raping Child, Intentionally Infecting Him With HIV"
"406","Professor Calls For White People To Die, College Says He Did No Wrong"
"4110","Professor Calls For White People To Die, College Says He Did No Wrong"
"426","Durham Report Shows Obama Committed TREASON  Ordered DOJ-FBI To Launch Trump Witch Hunt"
"436","Rep. Jim Jordan calls for Durham to testify next week on exonerating report for Trump"
"446","Trump reacts to the Durham report: the American Public was scammed"
"456","IRS removes entire investigative team in Hunter Biden probe, whistleblower claims retaliation: report"
"466","Entertainment Lawyer Kevin Morris Emerges as Major Figure in Hunter Biden Investigation"
"476","Durham: Obama, Biden Briefed on Clinton Plan to Link Trump to Russia"
"486","Legal Experts: Emails Show Hunter Biden Broke the Law Peddling Influence While Joe Biden Was VP"
"496","IRS Whistleblowers Team Getting Kicked From Hunter Biden Probe, Lawyers Say"
"506","Whistleblower: IRS Removes 'Entire Team' Probing Hunter Biden"
"5110","Durham's Much-Needed Record Of Deep-State And Dem Corruption Proves Conservatives Were Spot-On - The Federalist"
"526","John Brennan Should Be In Prison"
"536","The Durham Report Shows The FBI Is A Threat To Democracy"
"546","Durham Report Shows Disinfo-Crazed Feds Are First To Believe It"
"556","WATCH: Even Jake Tapper Has to Admit How 'Devastating' the Durham Report Is"
"566","In Shocking Development, IRS Removes Team Investigating Hunter Biden After DOJ Request"
"576","Durham Report: FBI Had No 'Actual Evidence,' Relied on Trump Opponents"
"586","CNNs Jake Tapper Says Durham Report Devastating To FBI, Exonerates Trump To A Degree"
"596","FBI Releases Statement Acknowledging Problems With Origins Of Trump-Russia Probe"
"606","Theres Nothing To This, But We Have To Run It To The Ground, Anti-Trump FBI Agent Strzok Said: Durham"
"6110","Chris Murphys Dangerous Threat Of 'Popular Revolt' Threatens The American Public"
"626","FBI Wanted To Pay Danchenko Even After Learning He Lied"
"636","Corporate Russia Hoaxers Dismiss Bombshell Durham Report"
"646","Everything FBI Ignored To Get Trump In Russian Collusion Hoax"
"656","Durham Report Finds New York Times Peddled Fake News"
"666","Durham Report Reveals FBI Vendetta Against Carter Page"
"676","Obama Admin Had No Evidence Of Trump-Russia Collusion"
"686","Trump says there 'must be a heavy price to pay' for Comey, Democrats after release of Durham report"
"696","JESSE WATTERS: The Trump Russia collusion story was a giant hoax started by Democrats"
"706","Bombshell Durham report confirms FBI, Justice Department had these radical motives"
"7110","Durham report: FBI displayed 'markedly different' treatment of Clinton, Trump campaigns"
"726","Biden Finally Draws Larger Crowd Than Trump"
"736","Chinese ownership of Alabama land, resources banned in proposed legislation"
"746","Top 10 takeaways from the Durham report"
"756","Mayor Eric Adams Wants to Revoke New Yorks Sanctuary City Status Amid Migrant Influx"
"766","Cop Called To House For Child Abuse Report, Kicks In Door and Finds Son"
"776","Cop Called To House For Child Abuse Report, Kicks In Door and Finds Son"
"786","Devin Nunes to Newsmax: Durham Report Should 'Scare Living Hell Out of Everyone'"
"796","Durham report: Trump says 'American public was scammed'"
"806","Durham report: Jake Tapper says findings exonerate Trump 'to a degree'"
"8110","Biden corruption informant goes MIA while DOJ 'turns a blind eye,' claims GOP rep"
"826","Senate GOP Want Answers On Biden's Election Interference"
"836","Unprecedented Gun Control: Democrats in Government Are Trying to Disarm Young Americans"
"846","BREAKING: 306-Page Durham Report Released, Blows up Any Idea of Collusion (Updated With Full Report)"
"856","FBI whistleblowers will testify on 'abuses of power' by agency at public 'Weaponization' hearing"
"866","Trump Pledges To Release All JFK Assassination Files If Re-Elected"
"876","READ IT: Durham Report Makes Sobering Findings About FBIs Handling Of Trump-Russia Probe"
"886","Nolte: Texas Drops Off Busload of Illegals at Kamalas Home"
"896","Durham report at DOJ pdf"
"906","Former AOC Aide Now Senior Official in the New York Communist Party"
"9110","Top Signer of Hunter Biden Laptop Letter Makes D.C. Magazine's 'Most Influential People' List"
"926","Durham Report: FBI Should Never Have Begun Russia Collusion Investigation"
"936","Tim Scott builds out 2024 team, taps Bill Haslam as national co-chair"
"946","Officials Say No Charges Will Be Filed After Texas Woman Is Eaten Alive"
"956","Officials Say No Charges Will Be Filed After Texas Woman Is Eaten Alive"
"966","Biden Hopeful of Debt Ceiling Deal as McCarthy Says Democrats Want a Default"
"976","Biden Hopeful of Debt Ceiling Deal as McCarthy Says Democrats Want a Default"
"986","McCarthy Criticizes Bidens Possible Use of 14th Amendment to Override Debt Limit - News Weekly"
"996","Fred Fleitz to Newsmax: 'Bombshells' in Hunter Biden Report"
"1006","Trump Surprised CNN 'Traumatized' by Town Hall"
"127","Texas Gov. Greg Abbott sends first bus of migrants to Colorado"
"227","Congresswoman Files Resolution to Expel Schiff After Explosive Discoveries in Durham Report"
"327","BREAKING: U.S. Convoy Attacked in Nigeria, Multiple Casualties - News Weekly"
"427","Explosive FBI Whistleblower Testimony Exposes 'Potential Federal Involvement with the Activities on January 6th'"
"527","Mayor Eric Adams: Nearly Half of NYC Hotel Rooms Now Filled with Migrants"
"627","The CCP incites racial hatred in American society, spreads false information"
"727","Baby Wasnt Able To Tell Parents About Cruel Sitter  But His Dog Could"
"827","Baby Wasnt Able To Tell Parents About Cruel Sitter  But His Dog Could"
"927","Barack Obama: We Need Full-Blown Govt Censorship To Eradicate Independent Media"
"107","Progressive Pro-Lifer's Mom Gets A Home Visit From FBI Karens"
"1111","Whistleblowers Expose FBI Corruption And Political Persecution"
"128","WATCH: FBI Agent's Powerful Statement About Retaliation Taken Against Him and His Family"
"137","Weaponization Committee: FBI Disparaging Whistleblowers After Revoking Their Security Clearances"
"147","FBI Whistleblowers Detail Egregious Abuse, Retribution From Politicized Bureau, House Report Says"
"157","Texas Childrens Hospital Performs Sex Change Procedures On Children As Young As 11: Report"
"167","America Last: Marjorie Taylor Greene Introduces Articles Of Impeachment Against Biden"
"177","Biden vetoes bipartisan resolution to restore tariffs on solar panel imports - Voz Media"
"187","Investigators Find Foreign Object Shoved Inside Teen Girl Who Was Killed"
"197","Smug Democrat's Attempt to Discredit FBI Whistleblower Falls Flat"
"207","PIC: American flag upside down over US Capitol"
"2111","Police Chief Refuses Pledge Of Allegiance, Holds Religion Above Duties"
"228","Police Chief Refuses Pledge Of Allegiance, Holds Religion Above Duties"
"237","US bill outlines UN status of Taiwan - Taipei Times"
"247","MTG drops new articles of impeachment against Joe Biden"
"257","GOP releases new report on government abuse and retaliation as FBI whistleblowers deliver testimony"
"267","Congresswoman files resolution to expel Rep. Adam Schiff for pushing 'false narratives' in Durham report"
"277","FBI visits home of pro-life activist's mother in act she says was meant 'to intimidate:' 'Refuse to back down'"
"287","FBI whistleblowers say pro-life groups, Catholics were 'target of the government': Jordan"
"297","D.C. mayor claims that the city has only 221 homeless"
"307","Retail Theft Is Driving A Shocking Amount Of Losses For Target, Executives Say"
"3111","Durham Finds Researcher Felt Threatened By Schiff Staffer"
"328","Pick The Crops And Clean Our Homes: Democrats Love Illegal Aliens For Cheap Labor  And Votes"
"337","Sen. Johnson to Newsmax: Durham Exposes Long Line of Corruption"
"347","Rep. Reschenthaler to Newsmax: FBI Needs 'Accountability'"
"357","GOP Rep. Luna: Expel Schiff From Congress"
"367","Whistleblowers Testify on FBI's Retaliation Methods"
"377","The Durham Report's Tacit Warning: Self-Government Is In Peril"
"387","FBI Employees Allege Retaliation After They Revealed the 'Political Rot'"
"397","Disregard the Debt-Ceiling Doomsayers"
