"","title"
"407","6 More Biden Terrorists Caught  They are streaming into America. MTG Submits Impeachment Docs - News Weekly"
"4111","Gun Sign Posted By 57,000 Businesses Makes People Lose Their Minds"
"428","Gun Sign Posted By 57,000 Businesses Makes People Lose Their Minds"
"437","Pete Buttigieg Takes Parental Leave Again After Adopting A Highway"
"447","Yet ANOTHER Sick Disney Employee Arrested In Possession Of Disturbing Child Porn"
"457","Outback Workers Wish Nobody Saw What They Wrote On Cops Receipt"
"467","Outback Workers Wish Nobody Saw What They Wrote On Cops Receipt"
"477","Is the Russia Hoax the Worst Political Scandal in American History?"
"487","Hunter Biden Lobbied Obama's State Department for Corrupt Romanian Oligarch without Registering as Foreign Agent"
"497","Chinese Communist Party has been waging 'economic war' against US for 'decades': former U.S. trade rep"
"507","Marjorie Taylor Greene files articles of impeachment against FBI Director Chris Wray"
"5111","Jim Jordan seeks justice amid Durham report revelations, calls on DOJ to prosecute and indict"
"528","Oversight Committee says the fed govt may have retaliated against a whistleblower"
"537","Border Crossers Soon to Enjoy Living in Manhattan's Iconic Roosevelt Hotel, Paid for by Taxpayers"
"547","NYC Moves Migrants Out of Public School Gym Amid Parent Protests"
"557","Schweizer: Oversight Panel Has Subpoenaed Joe Biden Phone Records"
"567","Crooks Open Fire On Man Who Saw Them Stealing Catalytic Converter"
"577","Crooks Open Fire On Man Who Saw Them Stealing Catalytic Converter"
"587","Fetterman Incoherent RAMBLING Goes Viral, Media PRAISES Garbled Nonsense, Democrats Are INSANE"
"597","Rep. Gallagher says US needs to take off 'golden blindfolds' and 'open our eyes' to China risk"
"607","Montana becomes first U.S. state to ban TikTok"
"6111","WATCH: Biden nominee stumbles through answers after Sen. Kennedy grills her on basic legal theory"
"628","BUSTED! Allen, TX shooting gun-grabbing eye witness (and Democrat) called OUT by the police for lying"
"637","Democrats put migrants first, Americans last"
"647","Cop Receives Note From 9-Year-Old Boy, Reads It, Jumps Out Of His Seat"
"657","Cop Receives Note From 9-Year-Old Boy, Reads It, Jumps Out Of His Seat"
"667","Soros-Backed U.S. Attorney Resigning After DOJ IG Accuses Her Of Election Interference, Lying To Feds: Reports"
"677","MTG Escalates Clash With DOJ, Moves To Impeach Garland"
"687","Flawed From The Start: Adam Schiff Doubles Down, Says Durham Investigation Was Political"
"697","Durham: UK Intel Rejected Trump-Russia Investigation Evidence"
"707","All Biden Has To Do Is Explain How His Family Got Foreign Cash"
"7111","6 Documented Instances Of Systemic Pro-Democrat FBI Corruption"
"728","IG Report Reveals Criminal Corruption by US Attorney in Massachusetts, Garland Declines to Prosecute"
"737","Durham Report EXONERATES Trump, Confirms Soft Coup AGAINST Trump"
"747","Woman Shames Cop For Eating On Duty, So He Tells Her About His Day"
"757","Woman Shames Cop For Eating On Duty, So He Tells Her About His Day"
"767","Republican Rep. Lauren Boebert files for divorce from husband of nearly 2 decades"
"777","Obama: I'm Most Worried About 'Divided Media,' We Have Different Realities"
"787","Detransitioner activist Chloe Cole speaks at Dartmouth despite student opposition"
"797","Durham Releases Final Report on FBI Trump-Russia Probe"
"807","Texas Woman Refused Service By Cashier Who Hates People Like Her"
"8111","Texas Woman Refused Service By Cashier Who Hates People Like Her"
"828","WATCH: Elon Musk Puts CNBC Journalist In His Place After He Says He Spreads Conspiracy Theories  How About Hunter Bidens Laptop?"
"837","BREAKING: Congressional Democrats Reintroduce Legislation to Pack the Supreme Court with Liberal Justices"
"847","The Durham report displays Clintons role in Trump-Russia lie"
"857","It was all a HOAX: Durham report proves Russia-Trump stories were fabricated"
"867","Media rushes to dismiss Durham findings that further debunked beloved Russian collusion narrative"
"877","Minnesota Senate passes sweeping gun control laws, including 'red flag law'"
"887","Ric Grenell to Newsmax: Not Buying FBI Response to Durham Report"
"897","Sen. Paul to Newsmax: Perpetuators of Russiagate Should Go to 'Prison'"
"907","Whistleblower: IRS Removes 'Entire Team' Probing Hunter Biden"
"9111","Republicans Can't Afford To Cower In The Weaponization Fight"
"928","Don't Miss The Most Damning Durham Finding"
"937","AR-15 Bans Are (Still) Unconstitutional"
"947","Comer Drops More Info on Missing Witnesses, Bribery Whistleblower, and Someone in WH Behind Intimidation"
"957","Karine Jean-Pierre Has a Snit Fit When Asked About Durham Report, Abruptly Leaves Podium"
"967","Abolishing the SEC: What It Means for Wall Street"
"977","BREAKING POLL: 57% of Americans say illegal immigration is getting worse, 66% say border is in crisis"
"987","Child Has Never Eaten A Gram Of Sugar  See How She Looks Now"
"997","Child Has Never Eaten A Gram Of Sugar  See How She Looks Now"
"1007","Marjorie Taylor Greene Moves To Impeach FBI Director Christopher Wray"
"129","Bombshell New Report Suggests Bill Gates Was Caught in Epstein Blackmail Scheme with Russian Woman"
"229","Speaker McCarthy Lands MAJOR Victory As He Forces FBI To Turn Over Damning Document Alleging Criminal Scheme Involving Joe Biden"
"329","Durham Is Right: Conservatives Cant Get A Fair Trial In D.C."
"429","Pelosi silent on Trump 'cold hard evidence' collusion claim after Durham report shows FBI, DOJ wrongdoing"
"529","University of Minnesota is Giving Out Paid Summer Research Internships  But Only for Students Who Are Not White"
"629","Bennet presents bill for new federal agency to enforce 'misinformation' and 'hate speech' by Americans"
"729","Biden says hes blameless if U.S. defaults on debt, blames Republicans"
"829","Report: Hunter Biden Claimed He Was Broke at Hearing After Flying on Jet"
"929","Dick Morris to Newsmax: 'Trump Is Developing a Real Cling'"
"108","Rep. Donalds Backs Trump's Stance on Debt Ceiling as Sign of Strength"
"1112","Republican Rep. Says Major Bank Gave Private Financial Data To FBI For Anyone In D.C. Around Jan 6"
"1210","McCarthy Expects FBI To Share File On Biden Bribery Allegations"
"138","NBC's Todd: Trust In FBI Eroding on the Left and Right -- 'We Need a Real Church Committee'"
"148","Hollywood star, former California resident lobbies for Texas filmmaking comeback: 'Business-friendly place'"
"158","Let's Call Them What They Are: Communists"
"168","Georgia Dem Blasts Her Party for Prioritizing Migrants Over 'Black Children'"
"178","Congress must exercise the power of the purse to limit what FBI, DOJ are doing to Americans: Rep. Jordan"
"188","FBI shut down four criminal investigations into the Clintons months prior to the 2016 election"
"198","Rep. Steube to Newsmax: FBI Retaliated Against Its Own Whistleblowers"
"208","Former AG Whitaker to Newsmax: FBI Must Fight Crime, Not Politics"
"2112","Rep. Van Drew to Newsmax: Govt Weaponization Worse Than Watergate"
"2210","Chinese Law REQUIRES All Foreign Companies to Host CCP Cells"
"238","Hunter Biden Faces Call for Key Business Associates in the Arkansas Proceedings"
"248","British intelligence found FBI Russia collusion probe so absurd it stopped helping"
"258","Abandon the Swamp : The only hope for the republic is to downgrade the place of Washington in our public life. The business of Washington is to make government biggerforever. That is not what the people want."
"268","A Cabal of Sociopaths"
"278","No Labels Eyes a Third-Party Run in 2024. Democrats Are Alarmed."
"288","Trump Is Soaring in the Polls"
"298","21% of Louisiana House Democrats vote to ban transitioning minors"
"308","Biden departs on a trip: The president, 80, STUMBLES as he descends a shrine's stairs as the G7 leaders wait for him before he leaves early from their group meal"
"3112","Nebraska passes weak gutted bill to protect minors from being transitioned"
"3210","Groomer Teacher Forced Out After Getting Caught, Media Lies To Protect Her"
"338","CNN Sound Alarms About Biden's Polling Numbers ""Lowest for Any American President at This Point in"
"348","Gorsuch gives scathing overview of COVID-era: Fear and the desire for safety are powerful forces"
"358","Were Not Going To Sit Here And Talk To Ourselves: GOP Negotiators Walk Out On Biden As Debt Ceiling Talks Crumble, Dems Arent Willing To Have Reasonable Conversations"
"368","Tennessee man charged with felony reckless endangerment after returning fire on armed auto thieves"
"378","Controversial Alabama Church Sign Sparks Community Outrage"
"388","Controversial Alabama Church Sign Sparks Community Outrage"
"398","The FBI Didnt Persecute Hillary. It Protected Her."
"408","Chicago-area man whose life sentence commuted by Obama charged with attempted murder"
"4112","Capitol Official Reveals What Caused American Flag to Fly Upside Down"
"4210","Capitol Official Reveals What Caused American Flag to Fly Upside Down"
"438","Devin Nunes to Newsmax: FBI, DOJ Enforcement Mechanism of Dems"
"448","Americans view George Soros negatively at 51% to 24%"
"458","(Video) Biden Stumbles While Walking Down Stairs at G7 Summit in Japan - News Weekly"
"468","My Own Great Reset, Teaching Children To Be Good Citizens (OBEY), Derangement Syndrome"
"478","For Decades, Democrats Have Been Ignoring Evidence And Facts"
"488","Trump to GOP: 'Do Not Fold!!!' as Debt Ceiling Talks Stall"
"498","DOJ Opted Not to Prosecute Radical U.S. Attorney for Massachusetts"
"508","Illegal Alien Accused of Killing Two, Injuring Five Others in Deadly Crash"
"5112","Court Document: FBI Misused Surveillance Powers Nearly 300K Times"
"5210","FBI improperly used warrantless search powers more than 278,000 times in 2021, FISA court filing reveals"
"538","Boebert slams Fetterman for wearing hoodie, shorts to Senate news conference: 'No excuse'"
"548","First Bus of Illegal Immigrants Arrives in Denver from Texas"
"558","New Hampshire Legislature Votes Against Requiring Schools to Tell Parents About Students Gender Transition"
"568","Republicans demand answers from NIH director after 2 involved in transgender youth study died by suicide"
"578","Obama, Clapper were briefed on reports of Clinton campaign&amp;#x27;s Russia collusion narrative, Durham report shows"
"588","Americans' Views of Federal Income Taxes Worsen"
"598","Twitters New CEO: Mask Up or Pack Up!"
"608","Politico Hit Piece Reveals that DeSantis is Married to a Smart Woman and has a Healthy Marriage"
"6112","Twitters New CEO: Mask Up or Pack Up!"
"6210","Dem Tries Linking FBI Whistleblower To Wrong Twitter Account. Gaetz Hilariously Trolls Her."
"638","Reparations plan put out by Cori Bush belongs in the 19th century"
"648","Dollar Store Clerk Shoots And Kills Armed Robber, Grieving Family Demand Justice"
"658","Dollar Store Clerk Shoots And Kills Armed Robber, Grieving Family Demand Justice"
"668","Seattle's King County now has 3.2 overdose deaths PER DAY."
"678","Principal Suspends Half Of Her Students, Sends Wake-Up Call To Parents"
"688","Principal Suspends Half Of Her Students, Sends Wake-Up Call To Parents"
"698","Jim Cramer just predicted that an economic wave will soon hit the US  and it will be 'fantastic for investors.' But is that a good sign or a bad sign for the stock market? - News Weekly"
"708","Fmr. Biden official arrested by four unmarked police, says report"
"7112","Mike Pence Caught Plagiarizing Lines Directly From Old Trump Speech, Word-For-Word"
"7210","Democratic Representative Attempts to Tie Twitter Account To Witness During Weaponization Committee Meeting"
"738","Trump: 'Also a Victim' in House 'Weaponization' Hearing"
"748","FBI Office Running The Hunter Probe Failed The Russia-Hoax Test"
"758","Its Too Late to Reform the FBI and Intelligence Agencies"
"768","Oops: $3 Billion Pentagon Accounting Error Means More Arms for Ukraine"
"778","Report: Biden Drone Killed Bricklayer Father of 10, Not Al-Qaeda Terrorist"
"788","DOJ Reportedly Attempting to Block Donald Trump Deposition in Lawsuit"
"798","DOJ Reportedly Attempting to Block Donald Trump Deposition in Lawsuit"
"808","North Dakota Gov. Doug Burgum Reportedly Considering Run For President"
"8112","Fox News Announces New Primetime Show: A Computer Playing Tuckers Twitter Show"
"8210","Sanctuary City Chicago: Migrants Accused of Stabbing, Shoplifting While Living in Taxpayer-Funded Shelters"
"838","Ron DeSantis Isnt Going to Legally Kidnap Your Children"
"848","Durham Report: FBI Shut Down Four Investigations into the Clintons"
"858","Durham Exonerates Trump of Russia Collusion Hoax, Seven Years Later"
"868","New Senate Bill Would Create Federal Agency to Police Americans for 'Misinformation' and 'Hate Speech"
"878","Federal Judge Blocks Most of N.J. Concealed Carry Law"
"888","Whistleblower Warns: 'The FBI Will Crush You'"
"898","Rep. Jim Jordan: FBI Targeted Whistleblowers, Americans"
"908","Committee Report: FBI Whistleblowers Exposed Abuses"
"9112","Rep. Matt Gaetz: FBI Director Wray Lied Under Oath"
"9210","Whistleblower to Newsmax: Flawed FBI Acts 'Like a Cop Trying to Hit a Quota'"
"938","Former FBI Official Tells House Republicans Bureau Denied Agents J6 Riot Footage To Protect Assets, Informants Present At U.S. Capitol"
"948","Reform California"
"958","GOP Files To EXPEL Adam Schiff, FBI Whistleblowers Testifying To EXPOSE Democrat Corruption"
"968","George Soros-backed Pittsburgh district attorney candidate wins Democratic primary"
"978","FBI shut down FOUR investigations into Hillary and Bill Clinton in 2016, Durham report reveals"
"988","Corvette Driver Shouldnt Have Rolled Down Window And Flipped The Bird"
"998","Corvette Driver Shouldnt Have Rolled Down Window And Flipped The Bird"
"1008","After heated whistleblower hearing, ex-FBI agent says current employees agree bureau has become politicized"
